<?xml version="1.0" encoding="utf-8"?>

<feedback xmlns:xs="http://www.w3.org/2001/XMLSchema-instance" xs:noNamespaceSchemaLocation="Feedback.xsd" code="10">
  <Name>ROhit</Name>
  <Address1> bkno:2059</Address1>
  <Address2>room no 1</Address2>
  <State> Maharashta</State> <City>Ulhasnagar</City>
  <pincode>421005</pincode>
  <Mobile_Number> 8983737455 </Mobile_Number>
  <Email>foo@capgemini.com</Email>
  <Select_Car_Model>Maruti</Select_Car_Model>
  <Checkbox>EngineRepair</Checkbox>
  <Total_Kilometers_Covered>100</Total_Kilometers_Covered>
  <Your_Feedback>HELLO </Your_Feedback>
 


</feedback>
  

